{
  "schema_version": "0.1.0",
  "created_at": "2026-02-18T00:00:00Z",
  "updated_at": "2026-02-18T00:00:00Z",
  "stages": [
    { "key": "discovery", "label": "Discovery" },
    { "key": "validation", "label": "Validation" },
    { "key": "reporting", "label": "Reporting" },
    { "key": "qa", "label": "QA" },
    { "key": "publishing", "label": "Publishing" },
    { "key": "closed", "label": "Closed" }
  ],
  "cases": [
    {
      "id": "case-0001",
      "title": "Template: Replace me",
      "program": {
        "name": "Program name",
        "platform": "Bugcrowd|HackerOne|VDP",
        "url": ""
      },
      "severity": "P? (unknown)",
      "status": "active",
      "stage": "discovery",
      "created_at": "2026-02-18T00:00:00Z",
      "updated_at": "2026-02-18T00:00:00Z",
      "timeline": [
        { "at": "2026-02-18T00:00:00Z", "type": "note", "summary": "Case created." }
      ],
      "links": []
    }
  ]
}

